{
  "formatVersion": "1.0",
  "name": "NICOLA(JIS)",
  "author": "日本語入力コンソーシアム",
  "description": "NICOLA 親指シフト入力（JIS キーボード）",
  "keyboardLayout": "jis",
  "targetScript": "hiragana",
  "modeKeys": {
    "ctrl+space": "toggleInputMode",
    "ctrl+shift+j": "switchToJapanese",
    "ctrl+shift+semicolon": "switchToEnglish",
    "space": "convert"
  },
  "behavior": {
    "type": "chord",
    "config": {
      "hidToKey": {
        "q": "Q",
        "w": "W",
        "e": "E",
        "r": "R",
        "t": "T",
        "y": "Y",
        "u": "U",
        "i": "I",
        "o": "O",
        "p": "P",
        "a": "A",
        "s": "S",
        "d": "D",
        "f": "F",
        "g": "G",
        "h": "H",
        "j": "J",
        "k": "K",
        "l": "L",
        "semicolon": "semicolon",
        "z": "Z",
        "x": "X",
        "c": "C",
        "v": "V",
        "b": "B",
        "n": "N",
        "m": "M",
        "comma": "comma",
        "period": "dot",
        "slash": "slash",
        "lang2": "leftThumb",
        "lang1": "rightThumb",
        "international5": "leftThumb",
        "international4": "rightThumb"
      },
      "shiftKeys": [
        {
          "key": "leftThumb"
        },
        {
          "key": "rightThumb"
        }
      ],
      "lookupTable": {
        "Q": "。",
        "W": "か",
        "E": "た",
        "R": "こ",
        "T": "さ",
        "Y": "ら",
        "U": "ち",
        "I": "く",
        "O": "つ",
        "P": "、",
        "semicolon": "ん",
        "A": "う",
        "S": "し",
        "D": "て",
        "F": "け",
        "G": "せ",
        "H": "は",
        "J": "と",
        "K": "き",
        "L": "い",
        "Z": "．",
        "X": "ひ",
        "C": "す",
        "V": "ふ",
        "B": "へ",
        "N": "め",
        "M": "そ",
        "comma": "ね",
        "dot": "ほ",
        "slash": "・",
        "leftThumb+Q": "ぁ",
        "leftThumb+W": "え",
        "leftThumb+E": "り",
        "leftThumb+R": "ゃ",
        "leftThumb+T": "れ",
        "leftThumb+Y": "ぱ",
        "leftThumb+U": "ぢ",
        "leftThumb+I": "ぐ",
        "leftThumb+O": "づ",
        "leftThumb+P": "ぴ",
        "leftThumb+semicolon": "ー",
        "leftThumb+A": "を",
        "leftThumb+S": "あ",
        "leftThumb+D": "な",
        "leftThumb+F": "ゅ",
        "leftThumb+G": "も",
        "leftThumb+H": "ば",
        "leftThumb+J": "ど",
        "leftThumb+K": "ぎ",
        "leftThumb+L": "ぽ",
        "leftThumb+Z": "ぅ",
        "leftThumb+X": "ー",
        "leftThumb+C": "ろ",
        "leftThumb+V": "や",
        "leftThumb+B": "ぃ",
        "leftThumb+N": "ぷ",
        "leftThumb+M": "ぞ",
        "leftThumb+comma": "ぺ",
        "leftThumb+dot": "ぼ",
        "leftThumb+slash": "ぉ",
        "rightThumb+Q": "ぁ",
        "rightThumb+W": "が",
        "rightThumb+E": "だ",
        "rightThumb+R": "ご",
        "rightThumb+T": "ざ",
        "rightThumb+Y": "よ",
        "rightThumb+U": "に",
        "rightThumb+I": "る",
        "rightThumb+O": "ま",
        "rightThumb+P": "ぇ",
        "rightThumb+semicolon": "っ",
        "rightThumb+A": "ゔ",
        "rightThumb+S": "じ",
        "rightThumb+D": "で",
        "rightThumb+F": "げ",
        "rightThumb+G": "ぜ",
        "rightThumb+H": "み",
        "rightThumb+J": "お",
        "rightThumb+K": "の",
        "rightThumb+L": "ょ",
        "rightThumb+Z": "ぅ",
        "rightThumb+X": "び",
        "rightThumb+C": "ず",
        "rightThumb+V": "ぶ",
        "rightThumb+B": "べ",
        "rightThumb+N": "ぬ",
        "rightThumb+M": "ゆ",
        "rightThumb+comma": "む",
        "rightThumb+dot": "わ",
        "rightThumb+slash": "ぉ"
      },
      "specialActions": {},
      "simultaneousWindow": 0.1
    }
  }
}
