{
  "formatVersion": "1.0",
  "name": "つばめ(US)",
  "author": "mikado",
  "description": "つばめ配列 2.0 行段系逐次入力（US キーボード）。ホームポジション10キーで50音を入力。交互打鍵＝清音、同手打鍵＝濁音。",
  "keyboardLayout": "us",
  "targetScript": "hiragana",
  "behavior": {
    "type": "sequential",
    "characterMap": {
      "0": "０", "1": "１", "2": "２", "3": "３", "4": "４",
      "5": "５", "6": "６", "7": "７", "8": "８", "9": "９",
      "[": "「", "]": "」", "{": "『", "}": "』",
      "(": "（", ")": "）", "<": "＜", ">": "＞",
      "-": "ー", "~": "〜", "^": "＾", "_": "＿",
      "\"": "\u201d", "'": "\u2019", "`": "｀",
      "+": "＋", "=": "＝", "*": "＊",
      "!": "！", "?": "？", ":": "：",
      "@": "＠", "#": "＃", "$": "＄", "%": "％",
      "&": "＆", "|": "｜", "\\": "＼", "¥": "￥"
    }
  },
  "modeKeys": {
    "ctrl+space": "toggleInputMode",
    "ctrl+shift+j": "switchToJapanese",
    "ctrl+shift+semicolon": "switchToEnglish"
  },
  "prefixShiftKeys": ["a", "s", "d", "f", "g", "h", "j", "k", "l", ";"],
  "inputMappings": {
    "_comment_upper_single": "単打（上段ショートカット）",
    "q": "ー",
    "w": "の",
    "e": "か",
    "r": "た",
    "t": "す",
    "y": "ろ",
    "u": "う",
    "i": "い",
    "o": "し",
    "p": "を",

    "_comment_lower_single": "単打（下段ショートカット）",
    "z": "あ",
    "x": "お",
    "c": "え",
    "v": "な",
    "b": "さ",
    "n": "ん",
    "m": "っ",
    ",": "、",
    ".": "。",

    "_comment_ka": "か行 K＝1打目（交互=清音、同手=濁音）",
    "ka": "か",
    "kd": "き",
    "kf": "く",
    "kg": "け",
    "ke": "け",
    "ks": "こ",
    "kq": "きゃ",
    "kr": "きゅ",
    "kw": "きょ",
    "k;": "が",
    "kk": "ぎ",
    "kj": "ぐ",
    "kh": "げ",
    "ki": "げ",
    "kl": "ご",
    "kp": "ぎゃ",
    "ku": "ぎゅ",
    "ko": "ぎょ",

    "_comment_sa": "さ行 S＝1打目",
    "s;": "さ",
    "sk": "し",
    "sj": "す",
    "sh": "せ",
    "si": "せ",
    "sl": "そ",
    "sp": "しゃ",
    "su": "しゅ",
    "so": "しょ",
    "sa": "ざ",
    "sd": "じ",
    "sf": "ず",
    "sg": "ぜ",
    "se": "ぜ",
    "ss": "ぞ",
    "sq": "じゃ",
    "sr": "じゅ",
    "sw": "じょ",

    "_comment_ta": "た行 G＝1打目",
    "g;": "た",
    "gk": "ち",
    "gj": "つ",
    "gh": "て",
    "gi": "て",
    "gl": "と",
    "gp": "ちゃ",
    "gu": "ちゅ",
    "go": "ちょ",
    "ga": "だ",
    "gd": "ぢ",
    "gf": "づ",
    "gg": "で",
    "ge": "で",
    "gs": "ど",
    "gq": "ぢゃ",
    "gr": "ぢゅ",
    "gw": "ぢょ",

    "_comment_na": "な行 H＝1打目（濁音なし、同手は句読点）",
    "ha": "な",
    "hd": "に",
    "hf": "ぬ",
    "hg": "ね",
    "he": "ね",
    "hs": "の",
    "hq": "にゃ",
    "hr": "にゅ",
    "hw": "にょ",
    "hk": "、",
    "hl": "。",

    "_comment_ha": "は行 ;＝1打目",
    ";a": "は",
    ";d": "ひ",
    ";f": "ふ",
    ";g": "へ",
    ";e": "へ",
    ";s": "ほ",
    ";q": "ひゃ",
    ";r": "ひゅ",
    ";w": "ひょ",
    ";;": "ば",
    ";k": "び",
    ";j": "ぶ",
    ";h": "べ",
    ";i": "べ",
    ";l": "ぼ",
    ";p": "びゃ",
    ";u": "びゅ",
    ";o": "びょ",

    "_comment_ma": "ま行 J＝1打目（同手＝ぱ行）",
    "ja": "ま",
    "jd": "み",
    "jf": "む",
    "jg": "め",
    "je": "め",
    "js": "も",
    "jq": "みゃ",
    "jr": "みゅ",
    "jw": "みょ",
    "j;": "ぱ",
    "jk": "ぴ",
    "jj": "ぷ",
    "jh": "ぺ",
    "ji": "ぺ",
    "jl": "ぽ",
    "jp": "ぴゃ",
    "ju": "ぴゅ",
    "jo": "ぴょ",

    "_comment_a": "あ行 A＝1打目（同手＝小書き）",
    "a;": "あ",
    "ak": "い",
    "aj": "う",
    "ah": "え",
    "ai": "え",
    "al": "お",
    "aa": "ぁ",
    "ad": "ぃ",
    "af": "ぅ",
    "ag": "ぇ",
    "ae": "ぇ",
    "as": "ぉ",

    "_comment_ya": "や行 D＝1打目（同手＝小書き、特殊：っ・ー）",
    "d;": "や",
    "dj": "ゆ",
    "dl": "よ",
    "da": "ゃ",
    "df": "ゅ",
    "ds": "ょ",
    "dk": "っ",
    "dh": "ー",
    "di": "ー",

    "_comment_ra": "ら行 F＝1打目（同手＝数字1-5）",
    "f;": "ら",
    "fk": "り",
    "fj": "る",
    "fh": "れ",
    "fi": "れ",
    "fl": "ろ",
    "fp": "りゃ",
    "fu": "りゅ",
    "fo": "りょ",
    "fa": "１",
    "fs": "２",
    "fd": "３",
    "ff": "４",
    "fg": "５",

    "_comment_wa": "わ行 L＝1打目（同手＝数字6-0）",
    "la": "わ",
    "ls": "を",
    "ld": "ん",
    "lh": "６",
    "lj": "７",
    "lk": "８",
    "ll": "９",
    "l;": "０"
  }
}
