{
  "formatVersion": "1.0",
  "name": "かわせみ配列(US)",
  "author": "semialt",
  "description": "左手で行（か・さ・た行等）を指定し右手で段（あ・い・う・え・お）を指定して同時押しするかな配列。50音表の行列構造を直接キー配置に対応させた覚えやすい同時打鍵方式（US キーボード）。",
  "license": "CC-BY-4.0",
  "keyboardLayout": "us",
  "targetScript": "hiragana",
  "modeKeys": {
    "ctrl+space": "toggleInputMode",
    "ctrl+shift+j": "switchToJapanese",
    "ctrl+shift+semicolon": "switchToEnglish"
  },
  "behavior": {
    "type": "chord",
    "config": {
      "hidToKey": {
        "q": "Q", "w": "W", "e": "E", "r": "R", "t": "T",
        "y": "Y", "u": "U", "i": "I", "o": "O", "p": "P",
        "a": "A", "s": "S", "d": "D", "f": "F", "g": "G",
        "h": "H", "j": "J", "k": "K", "l": "L", "semicolon": "semicolon",
        "z": "Z", "x": "X", "c": "C", "v": "V", "b": "B",
        "n": "N", "m": "M", "comma": "comma", "period": "dot", "slash": "slash"
      },
      "shiftKeys": [],
      "simultaneousWindow": 0.1,
      "lookupTable": {
        "_comment_single": "単打",
        "Q": "に", "W": "が", "E": "じ", "R": "で", "T": "ば",
        "Y": "れ", "U": "よ", "I": "ゆ", "O": "や", "P": "を",
        "A": "の", "S": "か", "D": "し", "F": "と", "G": "は",
        "H": "え", "J": "お", "K": "う", "L": "い", "semicolon": "あ",
        "Z": "な", "X": "る", "C": "ま", "V": "て", "B": "わ",
        "N": "っ", "M": "ん", "comma": "，", "dot": "．", "slash": "－",

        "_comment_na": "な行 [A]",
        "A+H": "ね", "A+J": "の", "A+K": "ぬ", "A+L": "に", "A+semicolon": "な",
        "A+U": "にょ", "A+I": "にゅ", "A+O": "にゃ",
        "A+N": "ねん", "A+M": "のん", "A+comma": "ぬん", "A+dot": "にん", "A+slash": "なん",

        "_comment_ka": "か行 [S]",
        "H+S": "け", "J+S": "こ", "K+S": "く", "L+S": "き", "S+semicolon": "か",
        "S+Y": "くぇ", "S+U": "きょ", "I+S": "きゅ", "O+S": "きゃ", "P+S": "くぁ",
        "N+S": "けん", "M+S": "こん", "S+comma": "くん", "S+dot": "きん", "S+slash": "かん",

        "_comment_sa": "さ行 [D]",
        "D+H": "せ", "D+J": "そ", "D+K": "す", "D+L": "し", "D+semicolon": "さ",
        "D+Y": "しぇ", "D+U": "しょ", "D+I": "しゅ", "D+O": "しゃ",
        "D+N": "せん", "D+M": "そん", "D+comma": "すん", "D+dot": "しん", "D+slash": "さん",

        "_comment_ta": "た行 [F]",
        "F+H": "て", "F+J": "と", "F+K": "つ", "F+L": "ち", "F+semicolon": "た",
        "F+Y": "ちぇ", "F+U": "ちょ", "F+I": "ちゅ", "F+O": "ちゃ", "F+P": "つぁ",
        "F+N": "てん", "F+M": "とん", "F+comma": "つん", "F+dot": "ちん", "F+slash": "たん",

        "_comment_ha": "は行 [G]",
        "G+H": "へ", "G+J": "ほ", "G+K": "ふ", "G+L": "ひ", "G+semicolon": "は",
        "G+Y": "ふぇ", "G+U": "ひょ", "G+I": "ひゅ", "G+O": "ひゃ", "G+P": "ふぁ",
        "G+N": "へん", "G+M": "ほん", "G+comma": "ふん", "G+dot": "ひん", "G+slash": "はん",

        "_comment_ra": "ら行 [X]",
        "H+X": "れ", "J+X": "ろ", "K+X": "る", "L+X": "り", "X+semicolon": "ら",
        "U+X": "りょ", "I+X": "りゅ", "O+X": "りゃ",
        "N+X": "れん", "M+X": "ろん", "X+comma": "るん", "X+dot": "りん", "X+slash": "らん",

        "_comment_ma": "ま行 [C]",
        "C+H": "め", "C+J": "も", "C+K": "む", "C+L": "み", "C+semicolon": "ま",
        "C+U": "みょ", "C+I": "みゅ", "C+O": "みゃ",
        "C+N": "めん", "C+M": "もん", "C+comma": "むん", "C+dot": "みん", "C+slash": "まん",

        "_comment_symbol": "記号 [V]",
        "V+Y": "『』", "U+V": "「」", "I+V": "（）", "O+V": "【】", "P+V": "〈〉",
        "J+V": "・", "K+V": "…", "L+V": "／", "V+semicolon": "《》",
        "V+comma": "，", "V+dot": "．",

        "_comment_pa": "ぱ行 [B]",
        "B+H": "ぺ", "B+J": "ぽ", "B+K": "ぷ", "B+L": "ぴ", "B+semicolon": "ぱ",
        "B+U": "ぴょ", "B+I": "ぴゅ", "B+O": "ぴゃ",
        "B+N": "ぺん", "B+M": "ぽん", "B+comma": "ぷん", "B+dot": "ぴん", "B+slash": "ぱん",

        "_comment_small": "捨て仮名・旧かな [Q]",
        "H+Q": "ぇ", "J+Q": "ぉ", "K+Q": "ぅ", "L+Q": "ぃ", "Q+semicolon": "ぁ",
        "Q+Y": "ヶ", "Q+U": "ょ", "I+Q": "ゅ", "O+Q": "ゃ", "P+Q": "ゎ",
        "N+Q": "ゑ", "Q+comma": "，", "Q+dot": "．", "Q+slash": "ヵ",

        "_comment_ga": "が行 [W]",
        "H+W": "げ", "J+W": "ご", "K+W": "ぐ", "L+W": "ぎ", "W+semicolon": "が",
        "W+Y": "ぐぇ", "U+W": "ぎょ", "I+W": "ぎゅ", "O+W": "ぎゃ",
        "N+W": "げん", "M+W": "ごん", "W+comma": "ぐん", "W+dot": "ぎん", "W+slash": "がん",

        "_comment_za": "ざ行 [E]",
        "E+H": "ぜ", "E+J": "ぞ", "E+K": "ず", "E+L": "じ", "E+semicolon": "ざ",
        "E+Y": "じぇ", "E+U": "じょ", "E+I": "じゅ", "E+O": "じゃ",
        "E+N": "ぜん", "E+M": "ぞん", "E+comma": "ずん", "E+dot": "じん", "E+slash": "ざん",

        "_comment_da": "だ行 [R]",
        "H+R": "で", "J+R": "ど", "K+R": "づ", "L+R": "ぢ", "R+semicolon": "だ",
        "R+Y": "ぢぇ", "R+U": "ぢょ", "I+R": "でゅ", "O+R": "ぢゃ",
        "N+R": "でん", "M+R": "どん", "R+comma": "づん", "R+dot": "ぢん", "R+slash": "だん",

        "_comment_ba": "ば行・ヴ行 [T]",
        "H+T": "べ", "J+T": "ぼ", "K+T": "ぶ", "L+T": "び", "T+semicolon": "ば",
        "T+Y": "ヴェ", "T+U": "びょ", "I+T": "びゅ", "O+T": "びゃ", "P+T": "ヴァ",
        "N+T": "べん", "M+T": "ぼん", "T+comma": "ぶん", "T+dot": "びん", "T+slash": "ばん"
      },
      "specialActions": {}
    }
  }
}
