{
  "formatVersion": "1.0",
  "name": "新下駄(JIS)",
  "author": "kouy",
  "description": "新下駄配列 同時打鍵方式（JIS キーボード）。単打＋中指シフト＋薬指シフト＋拗音同時押し。",
  "keyboardLayout": "jis",
  "targetScript": "hiragana",
  "modeKeys": {
    "lang2": "switchToEnglish",
    "lang1": "switchToJapanese",
    "ctrl+space": "toggleInputMode",
    "ctrl+shift+j": "switchToJapanese",
    "ctrl+shift+semicolon": "switchToEnglish"
  },
  "behavior": {
    "type": "chord",
    "config": {
      "hidToKey": {
        "q": "Q",
        "w": "W",
        "e": "E",
        "r": "R",
        "t": "T",
        "y": "Y",
        "u": "U",
        "i": "I",
        "o": "O",
        "p": "P",
        "a": "A",
        "s": "S",
        "d": "D",
        "f": "F",
        "g": "G",
        "h": "H",
        "j": "J",
        "k": "K",
        "l": "L",
        "semicolon": "semicolon",
        "z": "Z",
        "x": "X",
        "c": "C",
        "v": "V",
        "b": "B",
        "n": "N",
        "m": "M",
        "comma": "comma",
        "period": "dot",
        "slash": "slash",
        "openBracket": "leftThumb",
        "singleQuote": "rightThumb"
      },
      "shiftKeys": [],
      "lookupTable": {
        "_comment_single": "単打面（30キー + @/[ 位置）",
        "Q": "ー",
        "W": "に",
        "E": "は",
        "R": "、",
        "T": "ち",
        "Y": "ぐ",
        "U": "ば",
        "I": "こ",
        "O": "が",
        "P": "ひ",
        "leftThumb": "げ",
        "A": "の",
        "S": "と",
        "D": "か",
        "F": "ん",
        "G": "っ",
        "H": "く",
        "J": "う",
        "K": "い",
        "L": "し",
        "semicolon": "な",
        "Z": "す",
        "X": "ま",
        "C": "き",
        "V": "る",
        "B": "つ",
        "N": "て",
        "M": "た",
        "comma": "で",
        "dot": "。",
        "slash": "ぶ",
        "_comment_middle_K": "中指シフト（K＋左手キー）",
        "K+Q": "ふぁ",
        "K+W": "ご",
        "K+E": "ふ",
        "K+R": "ふぃ",
        "K+T": "ふぇ",
        "K+A": "ほ",
        "K+S": "じ",
        "K+D": "れ",
        "K+F": "も",
        "K+G": "ゆ",
        "K+Z": "づ",
        "K+X": "ぞ",
        "K+C": "ぼ",
        "K+V": "む",
        "K+B": "ふぉ",
        "_comment_middle_D": "中指シフト（D＋右手キー）",
        "D+Y": "うぃ",
        "D+U": "ぱ",
        "D+I": "よ",
        "D+O": "み",
        "D+P": "うぇ",
        "D+leftThumb": "うぉ",
        "D+H": "へ",
        "D+J": "あ",
        "D+semicolon": "え",
        "D+N": "せ",
        "D+M": "ね",
        "D+comma": "べ",
        "D+dot": "ぷ",
        "D+slash": "ゔ",
        "_comment_ring_L": "薬指シフト（L＋左手キー）",
        "L+Q": "ぢ",
        "L+W": "め",
        "L+E": "け",
        "L+R": "てぃ",
        "L+T": "でぃ",
        "L+A": "を",
        "L+S": "さ",
        "L+D": "お",
        "L+F": "り",
        "L+G": "ず",
        "L+Z": "ぜ",
        "L+X": "ざ",
        "L+C": "ぎ",
        "L+V": "ろ",
        "L+B": "ぬ",
        "_comment_ring_S": "薬指シフト（S＋右手キー）",
        "S+Y": "しぇ",
        "S+U": "ぺ",
        "S+I": "ど",
        "S+O": "や",
        "S+P": "じぇ",
        "S+H": "び",
        "S+J": "ら",
        "S+semicolon": "そ",
        "S+N": "わ",
        "S+M": "だ",
        "S+comma": "ぴ",
        "S+dot": "ぽ",
        "S+slash": "ちぇ",
        "_comment_youon_I": "拗音（I＋左手キー）",
        "I+Q": "ひゅ",
        "I+W": "しゅ",
        "I+E": "しょ",
        "I+R": "きゅ",
        "I+T": "ちゅ",
        "I+A": "ひょ",
        "I+Z": "ひゃ",
        "I+X": "くぇ",
        "I+C": "しゃ",
        "I+F": "きょ",
        "I+G": "ちょ",
        "I+V": "きゃ",
        "I+B": "ちゃ",
        "_comment_youon_O": "拗音（O＋左手キー）",
        "O+Q": "りゅ",
        "O+W": "じゅ",
        "O+E": "じょ",
        "O+R": "ぎゅ",
        "O+T": "にゅ",
        "O+A": "りょ",
        "O+Z": "りゃ",
        "O+X": "ぐぇ",
        "O+C": "じゃ",
        "O+F": "ぎょ",
        "O+G": "にょ",
        "O+V": "ぎゃ",
        "O+B": "にゃ",
        "_comment_symbols": "記号（同手隣接キー同時押し）",
        "W+E": "（",
        "E+R": "！",
        "E+F": "〜",
        "R+G": "・",
        "S+D": "「",
        "F+G": "「",
        "D+V": "＠",
        "X+C": "｛",
        "C+V": "、",
        "U+I": "？",
        "I+O": "）",
        "U+H": "【",
        "H+J": "（",
        "K+L": "」",
        "K+N": "＼",
        "M+comma": "、",
        "comma+dot": "｝",
        "F+V": "！",
        "F+B": "！",
        "N+J": "？",
        "R+F": "・"
      },
      "specialActions": {
        "rightThumb": "deleteBack"
      },
      "simultaneousWindow": 0.07
    }
  }
}
