{
  "formatVersion": "1.0",
  "name": "月配列2-263(JIS)",
  "description": "月配列2-263 前置シフト方式（JIS キーボード）",
  "keyboardLayout": "jis",
  "targetScript": "hiragana",
  "behavior": {
    "type": "sequential",
    "characterMap": {
      "0": "０",
      "1": "１",
      "2": "２",
      "3": "３",
      "4": "４",
      "5": "５",
      "6": "６",
      "7": "７",
      "8": "８",
      "9": "９",
      "]": "」",
      "{": "『",
      "}": "』",
      "(": "（",
      ")": "）",
      "<": "＜",
      ">": "＞",
      "-": "ー",
      "~": "〜",
      "^": "＾",
      "_": "＿",
      "\"": "”",
      "`": "｀",
      "+": "＋",
      "=": "＝",
      "*": "＊",
      "!": "！",
      "?": "？",
      "'": "＇",
      "#": "＃",
      "$": "＄",
      "%": "％",
      "&": "＆",
      "|": "｜",
      "\\": "＼",
      "¥": "￥"
    }
  },
  "modeKeys": {
    "lang2": "switchToEnglish",
    "lang1": "switchToJapanese",
    "ctrl+space": "toggleInputMode",
    "ctrl+shift+j": "switchToJapanese",
    "ctrl+shift+semicolon": "switchToEnglish",
    "space": "convert"
  },
  "prefixShiftKeys": [
    "d",
    "k"
  ],
  "inputMappings": {
    "_comment_base_top": "単打（上段）",
    "q": "そ",
    "w": "こ",
    "e": "し",
    "r": "て",
    "t": "ょ",
    "y": "つ",
    "u": "ん",
    "i": "い",
    "o": "の",
    "p": "り",
    "_comment_base_middle": "単打（中段）— JIS では US の [ → @、' → : に対応",
    "a": "は",
    "s": "か",
    "@": "ち",
    "f": "と",
    "g": "た",
    "h": "く",
    "j": "う",
    ":": "れ",
    ";": "き",
    "_comment_base_bottom": "単打（下段）",
    "z": "す",
    "x": "け",
    "c": "に",
    "v": "な",
    "b": "さ",
    "n": "っ",
    "m": "る",
    ",": "、",
    ".": "。",
    "l": "゛",
    "/": "゜",
    "_comment_d_prefix": "d 前置シフト",
    "dq": "ぁ",
    "dw": "ひ",
    "de": "ほ",
    "dr": "ふ",
    "dt": "め",
    "dy": "ぬ",
    "du": "え",
    "di": "み",
    "do": "や",
    "dp": "ぇ",
    "da": "ぃ",
    "ds": "を",
    "dd": "ら",
    "df": "あ",
    "dg": "よ",
    "dh": "ま",
    "dj": "お",
    "dk": "も",
    "dl": "わ",
    "d;": "ゆ",
    "dz": "ぅ",
    "dx": "へ",
    "dc": "せ",
    "dv": "ゅ",
    "db": "ゃ",
    "dn": "む",
    "dm": "ろ",
    "d,": "ね",
    "d.": "ー",
    "d/": "ぉ",
    "d@": "「",
    "d:": "」",
    "_comment_k_prefix": "k 前置シフト",
    "kq": "ぁ",
    "kw": "ひ",
    "ke": "ほ",
    "kr": "ふ",
    "kt": "め",
    "ky": "ぬ",
    "ku": "え",
    "ki": "み",
    "ko": "や",
    "kp": "ぇ",
    "ka": "ぃ",
    "ks": "を",
    "kd": "ら",
    "kf": "あ",
    "kg": "よ",
    "kh": "ま",
    "kj": "お",
    "kk": "も",
    "kl": "わ",
    "k;": "ゆ",
    "kz": "ぅ",
    "kx": "へ",
    "kc": "せ",
    "kv": "ゅ",
    "kb": "ゃ",
    "kn": "む",
    "km": "ろ",
    "k,": "ね",
    "k.": "ー",
    "k/": "ぉ",
    "k@": "「",
    "k:": "」",
    "_comment_voiced": "後置濁音（l 後置）",
    "sl": "が",
    ";l": "ぎ",
    "hl": "ぐ",
    "xl": "げ",
    "wl": "ご",
    "bl": "ざ",
    "el": "じ",
    "zl": "ず",
    "ql": "ぞ",
    "gl": "だ",
    "yl": "づ",
    "rl": "で",
    "fl": "ど",
    "al": "ば",
    "@l": "ぢ",
    "jl": "ゔ",
    "_comment_voiced_shifted": "前置シフト + 後置濁音",
    "dwl": "び",
    "drl": "ぶ",
    "dxl": "べ",
    "del": "ぼ",
    "dcl": "ぜ",
    "kwl": "び",
    "krl": "ぶ",
    "kxl": "べ",
    "kel": "ぼ",
    "kcl": "ぜ",
    "_comment_semi_voiced": "半濁音（/ 後置）",
    "a/": "ぱ",
    "dw/": "ぴ",
    "dr/": "ぷ",
    "dx/": "ぺ",
    "de/": "ぽ",
    "kw/": "ぴ",
    "kr/": "ぷ",
    "kx/": "ぺ",
    "ke/": "ぽ"
  }
}
