{
  "formatVersion": "1.0",
  "name": "AZIK(US)",
  "author": "木村清",
  "description": "AZIK 拡張ローマ字入力（US キーボード）",
  "keyboardLayout": "us",
  "targetScript": "hiragana",
  "behavior": {
    "type": "sequential",
    "characterMap": {
      "0": "０",
      "1": "１",
      "2": "２",
      "3": "３",
      "4": "４",
      "5": "５",
      "6": "６",
      "7": "７",
      "8": "８",
      "9": "９",
      "{": "『",
      "}": "』",
      "(": "（",
      ")": "）",
      "<": "＜",
      ">": "＞",
      "^": "＾",
      "_": "＿",
      "\"": "”",
      "'": "’",
      "`": "｀",
      "+": "＋",
      "=": "＝",
      "*": "＊",
      "!": "！",
      "?": "？",
      "@": "＠",
      "#": "＃",
      "$": "＄",
      "%": "％",
      "&": "＆",
      "|": "｜",
      "\\": "＼",
      "¥": "￥"
    }
  },
  "modeKeys": {
    "ctrl+space": "toggleInputMode",
    "ctrl+shift+j": "switchToJapanese",
    "ctrl+shift+semicolon": "switchToEnglish",
    "space": "convert"
  },
  "prefixShiftKeys": [],
  "inputBase": "romaji",
  "suffixRules": {
    "z": {
      "vowel": "a",
      "suffix": "ん"
    },
    "n": {
      "vowel": "a",
      "suffix": "ん"
    },
    "k": {
      "vowel": "i",
      "suffix": "ん"
    },
    "j": {
      "vowel": "u",
      "suffix": "ん"
    },
    "d": {
      "vowel": "e",
      "suffix": "ん"
    },
    "l": {
      "vowel": "o",
      "suffix": "ん"
    },
    "q": {
      "vowel": "a",
      "suffix": "い"
    },
    "h": {
      "vowel": "u",
      "suffix": "う"
    },
    "w": {
      "vowel": "e",
      "suffix": "い"
    },
    "p": {
      "vowel": "o",
      "suffix": "う"
    }
  },
  "inputMappings": {
    "_comment_special": "単打特殊キー",
    "q": "ん",
    ";": "っ",
    "-": "ー",
    ":": "ー",
    "~": "〜",
    ".": "。",
    ",": "、",
    "/": "・",
    "[": "「",
    "]": "」",
    "_comment_z_symbols": "z + 記号",
    "z/": "・",
    "z.": "…",
    "z,": "‥",
    "z-": "〜",
    "z[": "『",
    "z]": "』",
    "_comment_aliases": "AZIK 拗音別名（g = y ショートカット）",
    "kga": "きゃ",
    "kgu": "きゅ",
    "kge": "きぇ",
    "kgo": "きょ",
    "xa": "しゃ",
    "xu": "しゅ",
    "xe": "しぇ",
    "xo": "しょ",
    "ca": "ちゃ",
    "cu": "ちゅ",
    "ce": "ちぇ",
    "co": "ちょ",
    "nga": "にゃ",
    "ngu": "にゅ",
    "nge": "にぇ",
    "ngo": "にょ",
    "hga": "ひゃ",
    "hgu": "ひゅ",
    "hge": "ひぇ",
    "hgo": "ひょ",
    "mga": "みゃ",
    "mgu": "みゅ",
    "mge": "みぇ",
    "mgo": "みょ",
    "pga": "ぴゃ",
    "pgu": "ぴゅ",
    "pge": "ぴぇ",
    "pgo": "ぴょ",
    "_comment_shortcuts_f": "子音 + f ショートカット",
    "kf": "き",
    "jf": "じゅ",
    "hf": "ふ",
    "yf": "ゆ",
    "mf": "む",
    "nf": "ぬ",
    "df": "で",
    "cf": "ちぇ",
    "pf": "ぽん",
    "wf": "わい",
    "sf": "さい",
    "_comment_shortcuts_double": "子音連打ショートカット",
    "ss": "せい",
    "rr": "られ",
    "tt": "たち",
    "_comment_shortcuts_z": "z + 子音ショートカット",
    "zc": "ざ",
    "zv": "ざい",
    "zf": "ぜ",
    "zx": "ぜい",
    "zr": "ざる",
    "_comment_shortcuts_word": "単語ショートカット",
    "kt": "こと",
    "wt": "わた",
    "km": "かも",
    "sr": "する",
    "nb": "ねば",
    "nt": "にち",
    "st": "した",
    "mn": "もの",
    "tm": "ため",
    "tr": "たら",
    "bt": "びと",
    "dt": "だち",
    "ms": "ます",
    "dm": "でも",
    "nr": "なる",
    "mt": "また",
    "gr": "がら",
    "wr": "われ",
    "ht": "ひと",
    "ds": "です",
    "kr": "から",
    "yr": "よる",
    "tb": "たび",
    "gt": "ごと",
    "_comment_azik_foreign": "AZIK 固有の外来音ショートカット",
    "tgi": "てぃ",
    "tgu": "とぅ",
    "dci": "でぃ",
    "dcu": "どぅ",
    "wso": "うぉ",
    "_comment_irregular_suffix": "不規則なサフィックス（suffix 展開と異なる出力）",
    "fp": "ふぉー",
    "vp": "ヴぉー",
    "vh": "ヴー",
    "tgh": "とぅー",
    "dch": "どぅー",
    "wp": "うぉー",
    "wl": "うぉん"
  }
}
