{
  "formatVersion": "1.0",
  "name": "ローマ字(Colemak JIS)",
  "author": "Shai Coleman",
  "license": "Unlicense",
  "description": "Colemak 配列でのローマ字入力（JIS キーボード）。iPadOS が Colemak をサポートしないため、アプリ側で QWERTY→Colemak キーリマップを行う。",
  "keyboardLayout": "jis",
  "targetScript": "hiragana",
  "behavior": {
    "type": "sequential",
    "characterMap": {
      "0": "０",
      "1": "１",
      "2": "２",
      "3": "３",
      "4": "４",
      "5": "５",
      "6": "６",
      "7": "７",
      "8": "８",
      "9": "９",
      ";": "；",
      "{": "『",
      "}": "』",
      "(": "（",
      ")": "）",
      "<": "＜",
      ">": "＞",
      "^": "＾",
      "_": "＿",
      "\"": "”",
      "'": "’",
      "`": "｀",
      "+": "＋",
      "=": "＝",
      "*": "＊",
      "!": "！",
      "?": "？",
      "@": "＠",
      "#": "＃",
      "$": "＄",
      "%": "％",
      "&": "＆",
      "|": "｜",
      "\\": "＼",
      "¥": "￥",
      "~": "〜"
    }
  },
  "keyRemap": {
    "_comment_top": "上段: QWERTY→Colemak",
    "e": "f",
    "r": "p",
    "t": "g",
    "y": "j",
    "u": "l",
    "i": "u",
    "o": "y",
    "p": ";",
    "_comment_middle": "中段: QWERTY→Colemak",
    "s": "r",
    "d": "s",
    "f": "t",
    "g": "d",
    "j": "n",
    "k": "e",
    "l": "i",
    ";": "o",
    "_comment_bottom": "下段: QWERTY→Colemak",
    "n": "k"
  },
  "modeKeys": {
    "lang2": "switchToEnglish",
    "lang1": "switchToJapanese",
    "ctrl+space": "toggleInputMode",
    "ctrl+shift+j": "switchToJapanese",
    "ctrl+shift+semicolon": "switchToEnglish",
    "space": "convert"
  },
  "prefixShiftKeys": [],
  "inputBase": "romaji",
  "inputMappings": {
    "_comment_punctuation": "句読点・記号",
    ",": "、",
    ".": "。",
    "/": "・",
    "-": "ー",
    "[": "「",
    "]": "」"
  }
}
